{
  "$schema": "http://json-schema.org/draft-07/schema#",
  "$id": "https://v7-engine/contracts/schemas/alphaforge/alphaforge_research_report.schema.json",
  "title": "AlphaForgeResearchReport",
  "description": "Aggregate cross-mode research report synthesizing all mode reports, promoted/rejected candidates, and V7 handoff packages. Owned by AlphaForge.",
  "type": "object",
  "required": [
    "schema_version",
    "alphaforge_report_id",
    "run_id",
    "created_at",
    "mode_reports",
    "promoted_candidates",
    "rejected_candidates",
    "multiple_hypothesis_control",
    "global_limitations",
    "v7_handoff_packages"
  ],
  "properties": {
    "schema_version": {
      "type": "string",
      "description": "Schema version."
    },
    "alphaforge_report_id": {
      "type": "string",
      "description": "Unique identifier for this aggregate report."
    },
    "run_id": {
      "type": "string",
      "description": "ResearchRunManifest run_id."
    },
    "created_at": {
      "type": "string",
      "format": "date-time"
    },
    "mode_reports": {
      "type": "array",
      "items": {
        "type": "object",
        "required": ["mode", "report_id", "verdict"],
        "properties": {
          "mode": { "type": "string", "enum": ["SCALP", "AGGRESSIVE_SCALP", "SWING"] },
          "report_id": { "type": "string" },
          "verdict": { "type": "string" },
          "summary": { "type": "string" }
        }
      },
      "description": "Summary of each mode's research report."
    },
    "promoted_candidates": {
      "type": "array",
      "items": {
        "type": "object",
        "properties": {
          "alpha_candidate_id": { "type": "string" },
          "mode": { "type": "string" },
          "reason": { "type": "string" }
        }
      },
      "description": "Candidates promoted to V7_CANDIDATE or CANDIDATE_FOR_V7_GATES."
    },
    "rejected_candidates": {
      "type": "array",
      "items": {
        "type": "object",
        "properties": {
          "alpha_candidate_id": { "type": "string" },
          "mode": { "type": "string" },
          "rejection_reason": { "type": "string" }
        }
      },
      "description": "Candidates rejected with reasons."
    },
    "multiple_hypothesis_control": {
      "type": "object",
      "description": "Aggregate MHT/data-snooping controls across all modes. BLOCKING: NONE_APPLIED or NOT_RUN prevent strong edge/profitability claims at the aggregate report level.",
      "required": [
        "aggregate_mht_status",
        "aggregate_tested_hypothesis_count",
        "aggregate_tested_feature_count",
        "aggregate_trial_count",
        "correction_method"
      ],
      "properties": {
        "aggregate_mht_status": {
          "type": "string",
          "enum": ["APPLIED_AND_PASSED", "APPLIED_WITH_WARNINGS", "NOT_RUN", "NONE_APPLIED"],
          "description": "Aggregate MHT status across modes. NOT_RUN/NONE_APPLIED blocks strong claims."
        },
        "aggregate_tested_hypothesis_count": { "type": "integer", "minimum": 0 },
        "aggregate_tested_feature_count": { "type": "integer", "minimum": 0 },
        "aggregate_trial_count": { "type": "integer", "minimum": 0 },
        "correction_method": { "type": "string", "description": "MHT correction method applied at aggregate level." },
        "false_discovery_control": { "type": "string" },
        "deflated_sharpe_or_pbo_assessment": { "type": "string" },
        "mht_block_reason": { "type": "string" }
      }
    },
    "global_limitations": {
      "type": "array",
      "items": { "type": "string" },
      "description": "Cross-mode limitations and caveats."
    },
    "v7_handoff_packages": {
      "type": "array",
      "items": {
        "type": "object",
        "properties": {
          "handoff_package_id": { "type": "string" },
          "mode": { "type": "string" },
          "recommended_status": { "type": "string" }
        }
      },
      "description": "V7HandoffPackage references."
    },
    "cross_mode_insights": {
      "type": "array",
      "items": { "type": "string" },
      "description": "Insights that span multiple modes."
    },
    "next_research_priorities": {
      "type": "array",
      "items": { "type": "string" },
      "description": "Recommended priorities for the next research cycle."
    }
  }
}
