{
  "schema_version": "1.0.0",
  "alphaforge_report_id": "afrr-example-001",
  "run_id": "run-example-all-modes-001",
  "created_at": "2026-06-20T00:00:00Z",
  "mode_reports": [
    {
      "mode": "SCALP",
      "mode_priority": "PRIMARY",
      "report_id": "mrr-scalp-example-001",
      "report_type": "primary_research_report",
      "verdict": "CONTINUE_RESEARCH",
      "summary": "SCALP primary research — dummy example. No empirical evidence yet. P0.8E: mode_priority+report_type required."
    },
    {
      "mode": "AGGRESSIVE_SCALP",
      "mode_priority": "PRIMARY",
      "report_id": "mrr-aggressive-scalp-example-001",
      "report_type": "primary_research_report",
      "verdict": "CONTINUE_RESEARCH",
      "summary": "AGGRESSIVE_SCALP primary research — dummy example. No empirical evidence yet. P0.8E: mode_priority+report_type required."
    },
    {
      "mode": "SWING",
      "mode_priority": "SECONDARY_BASELINE",
      "report_id": "mrr-swing-example-001",
      "report_type": "secondary_baseline_report",
      "verdict": "BASELINE_WEAK",
      "summary": "SWING secondary baseline — dummy example. No empirical evidence yet. P0.8E: mode_priority+report_type required."
    }
  ],
  "promoted_candidates": [],
  "rejected_candidates": [
    {
      "alpha_candidate_id": "ac-example-001",
      "mode": "SCALP",
      "rejection_reason": "Dummy candidate — no real data. Rejected by default in minimal fixture."
    }
  ],
  "global_limitations": [
    "This is a minimal fixture for schema validation only",
    "No real market data was used",
    "No real models were trained",
    "No real validation was performed",
    "All three modes have zero empirical evidence",
    "Funding model is DEFERRED for all modes",
    "P0.8E: mode coverage enforced (SCALP+AGGRESSIVE_SCALP PRIMARY, SWING SECONDARY_BASELINE)"
  ],
  "multiple_hypothesis_control": {
    "aggregate_mht_status": "NOT_RUN",
    "aggregate_tested_hypothesis_count": 0,
    "aggregate_tested_feature_count": 0,
    "aggregate_trial_count": 0,
    "correction_method": "NONE_APPLIED",
    "false_discovery_control": "NOT_APPLIED",
    "deflated_sharpe_or_pbo_assessment": "NOT_APPLIED",
    "mht_block_reason": "Fixture-only report — no empirical MHT performed. Strong edge/profitability claims are BLOCKED."
  },
  "v7_handoff_packages": [],
  "cross_mode_insights": [
    "Dummy example — no cross-mode insights available",
    "SCALP and AGGRESSIVE_SCALP share cost-sensitivity concerns at higher frequencies",
    "SWING provides secondary baseline for architectural validation at 4h"
  ],
  "next_research_priorities": [
    "Obtain real market data for all modes at locked primary timeframes",
    "Run simulations for SCALP (1h) and AGGRESSIVE_SCALP (15m)",
    "Validate SWING baseline (4h) with real data",
    "Establish empirical evidence before any V7 handoff"
  ]
}